{
  "$schema": "https://json-schema.org/draft/2020-12/schema",
  "title": "CompareReceipt",
  "type": "object",
  "properties": {
    "baseline_ref": {
      "$ref": "#/$defs/CompareRef"
    },
    "bench": {
      "$ref": "#/$defs/BenchMeta"
    },
    "budgets": {
      "type": "object",
      "properties": {
        "binary_bytes": {
          "$ref": "#/$defs/Budget"
        },
        "cpu_ms": {
          "$ref": "#/$defs/Budget"
        },
        "ctx_switches": {
          "$ref": "#/$defs/Budget"
        },
        "max_rss_kb": {
          "$ref": "#/$defs/Budget"
        },
        "page_faults": {
          "$ref": "#/$defs/Budget"
        },
        "throughput_per_s": {
          "$ref": "#/$defs/Budget"
        },
        "wall_ms": {
          "$ref": "#/$defs/Budget"
        }
      },
      "additionalProperties": false
    },
    "current_ref": {
      "$ref": "#/$defs/CompareRef"
    },
    "deltas": {
      "type": "object",
      "properties": {
        "binary_bytes": {
          "$ref": "#/$defs/Delta"
        },
        "cpu_ms": {
          "$ref": "#/$defs/Delta"
        },
        "ctx_switches": {
          "$ref": "#/$defs/Delta"
        },
        "max_rss_kb": {
          "$ref": "#/$defs/Delta"
        },
        "page_faults": {
          "$ref": "#/$defs/Delta"
        },
        "throughput_per_s": {
          "$ref": "#/$defs/Delta"
        },
        "wall_ms": {
          "$ref": "#/$defs/Delta"
        }
      },
      "additionalProperties": false
    },
    "schema": {
      "type": "string"
    },
    "tool": {
      "$ref": "#/$defs/ToolInfo"
    },
    "verdict": {
      "$ref": "#/$defs/Verdict"
    }
  },
  "required": [
    "schema",
    "tool",
    "bench",
    "baseline_ref",
    "current_ref",
    "budgets",
    "deltas",
    "verdict"
  ],
  "$defs": {
    "BenchMeta": {
      "type": "object",
      "properties": {
        "command": {
          "description": "argv vector (no shell parsing).",
          "type": "array",
          "items": {
            "type": "string"
          }
        },
        "cwd": {
          "description": "Optional working directory (stringified path).",
          "type": [
            "string",
            "null"
          ]
        },
        "name": {
          "type": "string"
        },
        "repeat": {
          "type": "integer",
          "format": "uint32",
          "minimum": 0
        },
        "timeout_ms": {
          "type": [
            "integer",
            "null"
          ],
          "format": "uint64",
          "minimum": 0
        },
        "warmup": {
          "type": "integer",
          "format": "uint32",
          "minimum": 0
        },
        "work_units": {
          "type": [
            "integer",
            "null"
          ],
          "format": "uint64",
          "minimum": 0
        }
      },
      "required": [
        "name",
        "command",
        "repeat",
        "warmup"
      ]
    },
    "Budget": {
      "type": "object",
      "properties": {
        "direction": {
          "$ref": "#/$defs/Direction"
        },
        "threshold": {
          "description": "Fail threshold, as a fraction (0.20 = 20% regression allowed).",
          "type": "number",
          "format": "double"
        },
        "warn_threshold": {
          "description": "Warn threshold, as a fraction.",
          "type": "number",
          "format": "double"
        }
      },
      "required": [
        "threshold",
        "warn_threshold",
        "direction"
      ]
    },
    "CompareRef": {
      "type": "object",
      "properties": {
        "path": {
          "type": [
            "string",
            "null"
          ]
        },
        "run_id": {
          "type": [
            "string",
            "null"
          ]
        }
      }
    },
    "Delta": {
      "type": "object",
      "properties": {
        "baseline": {
          "type": "number",
          "format": "double"
        },
        "current": {
          "type": "number",
          "format": "double"
        },
        "pct": {
          "description": "(current - baseline) / baseline",
          "type": "number",
          "format": "double"
        },
        "ratio": {
          "description": "current / baseline",
          "type": "number",
          "format": "double"
        },
        "regression": {
          "description": "Positive regression amount, normalized as a fraction.",
          "type": "number",
          "format": "double"
        },
        "significance": {
          "anyOf": [
            {
              "$ref": "#/$defs/Significance"
            },
            {
              "type": "null"
            }
          ]
        },
        "statistic": {
          "$ref": "#/$defs/MetricStatistic"
        },
        "status": {
          "$ref": "#/$defs/MetricStatus"
        }
      },
      "required": [
        "baseline",
        "current",
        "ratio",
        "pct",
        "regression",
        "status"
      ]
    },
    "Direction": {
      "type": "string",
      "enum": [
        "lower",
        "higher"
      ]
    },
    "MetricStatistic": {
      "type": "string",
      "enum": [
        "median",
        "p95"
      ]
    },
    "MetricStatus": {
      "type": "string",
      "enum": [
        "pass",
        "warn",
        "fail"
      ]
    },
    "Significance": {
      "type": "object",
      "properties": {
        "alpha": {
          "type": "number",
          "format": "double"
        },
        "baseline_samples": {
          "type": "integer",
          "format": "uint32",
          "minimum": 0
        },
        "current_samples": {
          "type": "integer",
          "format": "uint32",
          "minimum": 0
        },
        "p_value": {
          "type": "number",
          "format": "double"
        },
        "significant": {
          "type": "boolean"
        },
        "test": {
          "$ref": "#/$defs/SignificanceTest"
        }
      },
      "required": [
        "test",
        "p_value",
        "alpha",
        "significant",
        "baseline_samples",
        "current_samples"
      ]
    },
    "SignificanceTest": {
      "type": "string",
      "enum": [
        "welch_t"
      ]
    },
    "ToolInfo": {
      "type": "object",
      "properties": {
        "name": {
          "type": "string"
        },
        "version": {
          "type": "string"
        }
      },
      "required": [
        "name",
        "version"
      ]
    },
    "Verdict": {
      "type": "object",
      "properties": {
        "counts": {
          "$ref": "#/$defs/VerdictCounts"
        },
        "reasons": {
          "type": "array",
          "items": {
            "type": "string"
          }
        },
        "status": {
          "$ref": "#/$defs/VerdictStatus"
        }
      },
      "required": [
        "status",
        "counts",
        "reasons"
      ]
    },
    "VerdictCounts": {
      "type": "object",
      "properties": {
        "fail": {
          "type": "integer",
          "format": "uint32",
          "minimum": 0
        },
        "pass": {
          "type": "integer",
          "format": "uint32",
          "minimum": 0
        },
        "warn": {
          "type": "integer",
          "format": "uint32",
          "minimum": 0
        }
      },
      "required": [
        "pass",
        "warn",
        "fail"
      ]
    },
    "VerdictStatus": {
      "type": "string",
      "enum": [
        "pass",
        "warn",
        "fail"
      ]
    }
  }
}