{"schema":"perfgate.compare.v1","tool":{"name":"perfgate","version":"0.1.0"},"bench":{"name":"test-benchmark","command":["sleep","0.1"],"repeat":5,"warmup":0},"baseline_ref":{"path":"crates/perfgate-cli/tests/fixtures/baseline.json","run_id":"baseline-run-001"},"current_ref":{"path":"crates/perfgate-cli/tests/fixtures/current_warn.json","run_id":"current-run-warn-001"},"budgets":{"wall_ms":{"threshold":0.2,"warn_threshold":0.18000000000000002,"direction":"lower"},"max_rss_kb":{"threshold":0.2,"warn_threshold":0.18000000000000002,"direction":"lower"}},"deltas":{"wall_ms":{"baseline":100.0,"current":119.0,"ratio":1.19,"pct":0.19,"regression":0.19,"status":"warn"},"max_rss_kb":{"baseline":1024.0,"current":1200.0,"ratio":1.171875,"pct":0.171875,"regression":0.171875,"status":"pass"}},"verdict":{"status":"warn","counts":{"pass":1,"warn":1,"fail":0},"reasons":["WallMs near budget: 19.00% (warn â‰¥ 18.00%, fail > 20.00%)"]}}