{"schema":"perfgate.compare.v1","tool":{"name":"perfgate","version":"0.5.0"},"bench":{"name":"render/md","command":["bash",".ci/perf/render-md.sh"],"repeat":7,"warmup":1},"baseline_ref":{"path":"baselines/gha-linux-x86_64/render/md.json","run_id":"6630adba-1487-4108-a1a1-f1f4a87bf766"},"current_ref":{"path":"artifacts/perfgate-smoke/render/md/run.json","run_id":"798233b8-7ea4-45db-8193-d800d9c14b65"},"budgets":{"binary_bytes":{"threshold":0.15,"warn_threshold":0.135,"direction":"lower"},"cpu_ms":{"threshold":0.15,"warn_threshold":0.135,"direction":"lower"},"max_rss_kb":{"threshold":0.15,"warn_threshold":0.135,"direction":"lower"},"page_faults":{"threshold":0.15,"warn_threshold":0.135,"direction":"lower"},"wall_ms":{"threshold":0.15,"warn_threshold":0.135,"direction":"lower"}},"deltas":{"binary_bytes":{"baseline":86016.0,"current":1446024.0,"ratio":16.811104910714285,"pct":15.811104910714286,"regression":15.811104910714286,"status":"fail"},"cpu_ms":{"baseline":15.0,"current":6.0,"ratio":0.4,"pct":-0.6,"regression":0.0,"status":"pass"},"max_rss_kb":{"baseline":8224.0,"current":6788.0,"ratio":0.8253891050583657,"pct":-0.17461089494163423,"regression":0.0,"status":"pass"},"page_faults":{"baseline":2113.0,"current":0.0,"ratio":0.0,"pct":-1.0,"regression":0.0,"status":"pass"},"wall_ms":{"baseline":128.0,"current":6.0,"ratio":0.046875,"pct":-0.953125,"regression":0.0,"status":"pass"}},"verdict":{"status":"fail","counts":{"pass":4,"warn":0,"fail":1},"reasons":["binary_bytes_fail"]}}