{"schema":"perfgate.compare.v1","tool":{"name":"perfgate","version":"0.5.0"},"bench":{"name":"cli/compare-small","command":["bash",".ci/perf/compare-small.sh"],"repeat":7,"warmup":1},"baseline_ref":{"path":"baselines/gha-linux-x86_64/cli/compare-small.json","run_id":"c48062fd-29a4-421e-ae40-3ac92799f6a0"},"current_ref":{"path":"artifacts/perfgate-smoke/cli/compare-small/run.json","run_id":"3bd1c8cb-fe33-4edb-9ba9-5e37dd97bc95"},"budgets":{"binary_bytes":{"threshold":0.15,"warn_threshold":0.135,"direction":"lower"},"cpu_ms":{"threshold":0.15,"warn_threshold":0.135,"direction":"lower"},"max_rss_kb":{"threshold":0.15,"warn_threshold":0.135,"direction":"lower"},"page_faults":{"threshold":0.15,"warn_threshold":0.135,"direction":"lower"},"wall_ms":{"threshold":0.12,"warn_threshold":0.108,"direction":"lower"}},"deltas":{"binary_bytes":{"baseline":86016.0,"current":1446024.0,"ratio":16.811104910714285,"pct":15.811104910714286,"regression":15.811104910714286,"status":"fail"},"cpu_ms":{"baseline":15.0,"current":6.0,"ratio":0.4,"pct":-0.6,"regression":0.0,"status":"pass"},"max_rss_kb":{"baseline":8220.0,"current":6660.0,"ratio":0.8102189781021898,"pct":-0.1897810218978102,"regression":0.0,"status":"pass"},"page_faults":{"baseline":2113.0,"current":0.0,"ratio":0.0,"pct":-1.0,"regression":0.0,"status":"pass"},"wall_ms":{"baseline":360.0,"current":7.0,"ratio":0.019444444444444445,"pct":-0.9805555555555555,"regression":0.0,"status":"pass"}},"verdict":{"status":"fail","counts":{"pass":4,"warn":0,"fail":1},"reasons":["binary_bytes_fail"]}}