{"schema":"perfgate.compare.v1","tool":{"name":"perfgate","version":"0.5.0"},"bench":{"name":"cli/check-single","command":["bash",".ci/perf/check-single.sh"],"repeat":7,"warmup":1},"baseline_ref":{"path":"baselines/gha-linux-x86_64/cli/check-single.json","run_id":"684496e9-fcc2-42a5-bea7-2211ea948dea"},"current_ref":{"path":"artifacts/perfgate-smoke/cli/check-single/run.json","run_id":"d78ba7b4-4d87-4345-a513-8cb1ef091729"},"budgets":{"binary_bytes":{"threshold":0.15,"warn_threshold":0.135,"direction":"lower"},"cpu_ms":{"threshold":0.15,"warn_threshold":0.135,"direction":"lower"},"max_rss_kb":{"threshold":0.15,"warn_threshold":0.135,"direction":"lower"},"page_faults":{"threshold":0.15,"warn_threshold":0.135,"direction":"lower"},"wall_ms":{"threshold":0.2,"warn_threshold":0.18000000000000002,"direction":"lower"}},"deltas":{"binary_bytes":{"baseline":86016.0,"current":1446024.0,"ratio":16.811104910714285,"pct":15.811104910714286,"regression":15.811104910714286,"status":"fail"},"cpu_ms":{"baseline":15.0,"current":11.0,"ratio":0.7333333333333333,"pct":-0.26666666666666666,"regression":0.0,"status":"pass"},"max_rss_kb":{"baseline":8216.0,"current":6788.0,"ratio":0.8261927945472249,"pct":-0.17380720545277506,"regression":0.0,"status":"pass"},"page_faults":{"baseline":2110.0,"current":0.0,"ratio":0.0,"pct":-1.0,"regression":0.0,"status":"pass"},"wall_ms":{"baseline":520.5,"current":11.0,"ratio":0.021133525456292025,"pct":-0.978866474543708,"regression":0.0,"statistic":"p95","status":"pass"}},"verdict":{"status":"fail","counts":{"pass":4,"warn":0,"fail":1},"reasons":["binary_bytes_fail"]}}