{
  "schema": "perfgate.compare.v1",
  "tool": {
    "name": "perfgate",
    "version": "0.18.0"
  },
  "bench": {
    "name": "large-file",
    "command": ["echo", "large-file fixture"],
    "repeat": 1,
    "warmup": 0
  },
  "baseline_ref": {
    "path": "baselines/large-file.json",
    "run_id": "large-file-baseline"
  },
  "current_ref": {
    "path": "artifacts/perfgate/large-file/run.json",
    "run_id": "large-file-current"
  },
  "budgets": {},
  "deltas": {
    "wall_ms": {
      "baseline": 100.0,
      "current": 90.0,
      "ratio": 0.9,
      "pct": -0.1,
      "regression": 0.0,
      "status": "pass"
    },
    "max_rss_kb": {
      "baseline": 100.0,
      "current": 130.0,
      "ratio": 1.3,
      "pct": 0.3,
      "regression": 0.3,
      "status": "fail"
    }
  },
  "verdict": {
    "status": "fail",
    "counts": {
      "pass": 1,
      "warn": 0,
      "fail": 1,
      "skip": 0
    },
    "reasons": ["max_rss_kb_fail"]
  }
}
