{"schema":"perfgate.compare.v1","tool":{"name":"perfgate","version":"0.5.0"},"bench":{"name":"render/report","command":["bash",".ci/perf/render-report.sh"],"repeat":7,"warmup":1},"baseline_ref":{"path":"baselines/gha-linux-x86_64/render/report.json","run_id":"89e77e60-798d-408e-a411-e761e60a5d41"},"current_ref":{"path":"artifacts/perfgate-smoke/render/report/run.json","run_id":"05d4b4ca-0bd0-4886-9d6f-c2c93d3a09cf"},"budgets":{"binary_bytes":{"threshold":0.15,"warn_threshold":0.135,"direction":"lower"},"cpu_ms":{"threshold":0.15,"warn_threshold":0.135,"direction":"lower"},"max_rss_kb":{"threshold":0.15,"warn_threshold":0.135,"direction":"lower"},"page_faults":{"threshold":0.15,"warn_threshold":0.135,"direction":"lower"},"wall_ms":{"threshold":0.15,"warn_threshold":0.135,"direction":"lower"}},"deltas":{"binary_bytes":{"baseline":86016.0,"current":1446024.0,"ratio":16.811104910714285,"pct":15.811104910714286,"regression":15.811104910714286,"status":"fail"},"cpu_ms":{"baseline":15.0,"current":6.0,"ratio":0.4,"pct":-0.6,"regression":0.0,"status":"pass"},"max_rss_kb":{"baseline":8220.0,"current":6788.0,"ratio":0.8257907542579075,"pct":-0.17420924574209246,"regression":0.0,"status":"pass"},"page_faults":{"baseline":2113.0,"current":0.0,"ratio":0.0,"pct":-1.0,"regression":0.0,"status":"pass"},"wall_ms":{"baseline":131.0,"current":7.0,"ratio":0.05343511450381679,"pct":-0.9465648854961832,"regression":0.0,"status":"pass"}},"verdict":{"status":"fail","counts":{"pass":4,"warn":0,"fail":1},"reasons":["binary_bytes_fail"]}}