{"schema":"perfgate.compare.v1","tool":{"name":"perfgate","version":"0.5.0"},"bench":{"name":"cli/check-no-baseline","command":["bash",".ci/perf/check-no-baseline.sh"],"repeat":7,"warmup":1},"baseline_ref":{"path":"baselines/gha-linux-x86_64/cli/check-no-baseline.json","run_id":"81893eac-5c59-42e0-9ad3-9b0674717a2d"},"current_ref":{"path":"artifacts/perfgate-smoke/cli/check-no-baseline/run.json","run_id":"532ed652-0771-4297-ab8e-8683af651fc9"},"budgets":{"binary_bytes":{"threshold":0.15,"warn_threshold":0.135,"direction":"lower"},"cpu_ms":{"threshold":0.15,"warn_threshold":0.135,"direction":"lower"},"max_rss_kb":{"threshold":0.15,"warn_threshold":0.135,"direction":"lower"},"page_faults":{"threshold":0.15,"warn_threshold":0.135,"direction":"lower"},"wall_ms":{"threshold":0.2,"warn_threshold":0.18000000000000002,"direction":"lower"}},"deltas":{"binary_bytes":{"baseline":86016.0,"current":1446024.0,"ratio":16.811104910714285,"pct":15.811104910714286,"regression":15.811104910714286,"status":"fail"},"cpu_ms":{"baseline":31.0,"current":11.0,"ratio":0.3548387096774194,"pct":-0.6451612903225806,"regression":0.0,"status":"pass"},"max_rss_kb":{"baseline":8224.0,"current":6788.0,"ratio":0.8253891050583657,"pct":-0.17461089494163423,"regression":0.0,"status":"pass"},"page_faults":{"baseline":2115.0,"current":0.0,"ratio":0.0,"pct":-1.0,"regression":0.0,"status":"pass"},"wall_ms":{"baseline":721.6,"current":12.0,"ratio":0.01662971175166297,"pct":-0.983370288248337,"regression":0.0,"statistic":"p95","status":"pass"}},"verdict":{"status":"fail","counts":{"pass":4,"warn":0,"fail":1},"reasons":["binary_bytes_fail"]}}