{"schema":"perfgate.compare.v1","tool":{"name":"perfgate","version":"0.5.0"},"bench":{"name":"test-bench","command":["./target/release/perfgate-selfbench.exe","noop"],"repeat":5,"warmup":1},"baseline_ref":{"path":".ci/fixtures/compare/small-baseline.json","run_id":"b70414db-83cc-486c-9f59-bd7ea4eb9335"},"current_ref":{"path":".ci/fixtures/compare/small-current.json","run_id":"4bb18107-e159-43de-99f5-88be4cb6bbac"},"budgets":{"binary_bytes":{"threshold":0.2,"warn_threshold":0.18000000000000002,"direction":"lower"},"cpu_ms":{"threshold":0.2,"warn_threshold":0.18000000000000002,"direction":"lower"},"max_rss_kb":{"threshold":0.2,"warn_threshold":0.18000000000000002,"direction":"lower"},"page_faults":{"threshold":0.2,"warn_threshold":0.18000000000000002,"direction":"lower"},"wall_ms":{"threshold":0.2,"warn_threshold":0.18000000000000002,"direction":"lower"}},"deltas":{"binary_bytes":{"baseline":238080.0,"current":238080.0,"ratio":1.0,"pct":0.0,"regression":0.0,"status":"pass"},"cpu_ms":{"baseline":15.0,"current":15.0,"ratio":1.0,"pct":0.0,"regression":0.0,"status":"pass"},"max_rss_kb":{"baseline":4124.0,"current":4128.0,"ratio":1.0009699321047527,"pct":0.0009699321047526673,"regression":0.0009699321047526673,"status":"pass"},"page_faults":{"baseline":1077.0,"current":1078.0,"ratio":1.000928505106778,"pct":0.0009285051067780873,"regression":0.0009285051067780873,"status":"pass"},"wall_ms":{"baseline":20.0,"current":20.0,"ratio":1.0,"pct":0.0,"regression":0.0,"status":"pass"}},"verdict":{"status":"pass","counts":{"pass":5,"warn":0,"fail":0},"reasons":[]}}